id,conversation_id,created_at,date,time,timezone,user_id,username,name,place,tweet,mentions,urls,photos,replies_count,retweets_count,likes_count,hashtags,cashtags,link,retweet,quote_url,video,near,geo,source,user_rt_id,user_rt,retweet_id,reply_to,retweet_date,translate,trans_src,trans_dest
1260244139142086657,1260244139142086657,1589300591000,2020-05-12,21:53:11,IST,18839785,narendramodi,Narendra Modi,,"The way ahead lies in LOCAL.

Local Manufacturing. 

Local Markets. 

Local Supply Chain.

Local is not merely a need but a responsibility. 

Be vocal about local! #AatmanirbharBharat pic.twitter.com/eYqt5IDtBp",[],[],[],4810,14252,56307,['#aatmanirbharbharat'],[],https://twitter.com/narendramodi/status/1260244139142086657,False,,1,,,,,,,"[{'user_id': '18839785', 'username': 'narendramodi'}]",,,,
1260243893498466309,1260243893498466309,1589300533000,2020-05-12,21:52:13,IST,18839785,narendramodi,Narendra Modi,,एक विशेष आर्थिक पैकेज जो ‘आत्मनिर्भर भारत अभियान’ की अहम कड़ी के तौर पर काम करेगा। #AatmanirbharBharat pic.twitter.com/59HERWpwJ4,[],[],[],1936,6812,31873,['#aatmanirbharbharat'],[],https://twitter.com/narendramodi/status/1260243893498466309,False,,1,,,,,,,"[{'user_id': '18839785', 'username': 'narendramodi'}]",,,,
1260243737801666561,1260243737801666561,1589300495000,2020-05-12,21:51:35,IST,18839785,narendramodi,Narendra Modi,,"आत्मनिर्भर भारत की यह भव्य इमारत, इन पांच पिलर्स पर खड़ी होगी... #AatmanirbharBharat pic.twitter.com/CmXdgEu3No",[],[],[],1290,7297,34844,['#aatmanirbharbharat'],[],https://twitter.com/narendramodi/status/1260243737801666561,False,,1,,,,,,,"[{'user_id': '18839785', 'username': 'narendramodi'}]",,,,
1260243604125052929,1260243604125052929,1589300464000,2020-05-12,21:51:04,IST,18839785,narendramodi,Narendra Modi,,"I cannot forget Kutch in 2001. The devastating quake destroyed a lot but never the determination of the people. 

In no time, Kutch bounced back.

The same way, India will. #AatmanirbharBharat pic.twitter.com/y4PpJngN0p",[],[],[],925,6067,28330,['#aatmanirbharbharat'],[],https://twitter.com/narendramodi/status/1260243604125052929,False,,1,,,,,,,"[{'user_id': '18839785', 'username': 'narendramodi'}]",,,,
1260243350726164481,1260243350726164481,1589300403000,2020-05-12,21:50:03,IST,18839785,narendramodi,Narendra Modi,,The post COVID-19 era will bring with it several opportunities and India's track record convinces me we will rise to the occasion and embrace the opportunities ahead. #AatmanirbharBharat pic.twitter.com/ymqe3bjiml,[],[],[],861,5655,24048,['#aatmanirbharbharat'],[],https://twitter.com/narendramodi/status/1260243350726164481,False,,1,,,,,,,"[{'user_id': '18839785', 'username': 'narendramodi'}]",,,,
1260243003479748611,1260243003479748611,1589300320000,2020-05-12,21:48:40,IST,18839785,narendramodi,Narendra Modi,,विश्व की आज की स्थिति हमें सिखाती है कि आगे का मार्ग है- “आत्मनिर्भर भारत”! #AatmanirbharBharat pic.twitter.com/rLYl3PpNBV,[],[],[],1893,8579,44902,['#aatmanirbharbharat'],[],https://twitter.com/narendramodi/status/1260243003479748611,False,,1,,,,,,,"[{'user_id': '18839785', 'username': 'narendramodi'}]",,,,
1260242787275956224,1260242787275956224,1589300269000,2020-05-12,21:47:49,IST,18839785,narendramodi,Narendra Modi,,"एक वायरस ने दुनिया को तहस-नहस कर दिया।

लेकिन थकना, हारना, टूटना-बिखरना, मानव को मंजूर नहीं है।

We will not be defeated by the virus. We will take the right precautions and overcome this menace.  
#AatmanirbharBharat pic.twitter.com/o8V0JFG4Z8",[],[],[],1750,6171,31197,['#aatmanirbharbharat'],[],https://twitter.com/narendramodi/status/1260242787275956224,False,,1,,,,,,,"[{'user_id': '18839785', 'username': 'narendramodi'}]",,,,
1260215676976820224,1260215676976820224,1589293805000,2020-05-12,20:00:05,IST,18839785,narendramodi,Narendra Modi,,Addressing the nation. https://www.pscp.tv/w/cYlY7TMyMjExNTJ8MXluSk9wWnZ3Qnp4UsBvsUThyOBFsw8AWhpSRx87S7Tfvbyg6GOuYWMgkJuj …,[],['https://www.pscp.tv/w/cYlY7TMyMjExNTJ8MXluSk9wWnZ3Qnp4UsBvsUThyOBFsw8AWhpSRx87S7Tfvbyg6GOuYWMgkJuj'],[],7979,24110,92670,[],[],https://twitter.com/narendramodi/status/1260215676976820224,False,,0,,,,,,,"[{'user_id': '18839785', 'username': 'narendramodi'}]",,,,
1260137669603946498,1260137415441707009,1589275207000,2020-05-12,14:50:07,IST,18839785,narendramodi,Narendra Modi,,"Inspired by Florence Nightingale, our hardworking nursing staff personify abundant compassion. Today, we also reiterate our commitment to keep working for welfare of nurses and devote greater attention to opportunities in this field so that there is no shortage of caregivers.",[],[],[],640,2990,19910,[],[],https://twitter.com/narendramodi/status/1260137669603946498,False,,0,,,,,,,"[{'user_id': '18839785', 'username': 'narendramodi'}]",,,,
1260137415441707009,1260137415441707009,1589275146000,2020-05-12,14:49:06,IST,18839785,narendramodi,Narendra Modi,,"International Day of the Nurse is a special day to express gratitude to the phenomenal nurses working round the clock to keep our planet healthy. Presently, they are doing great work towards defeating COVID-19. We are extremely grateful to the nurses and their families.",[],[],[],2014,8567,64453,[],[],https://twitter.com/narendramodi/status/1260137415441707009,False,,0,,,,,,,"[{'user_id': '18839785', 'username': 'narendramodi'}]",,,,
1260046264554500096,1260046264554500096,1589253414000,2020-05-12,08:46:54,IST,18839785,narendramodi,Narendra Modi,,Greetings to Tamil Nadu CM Thiru Edappadi K. Palaniswami Ji on his birthday. May Almighty bless him with good health and a long life in service of people. @CMOTamilNadu,['cmotamilnadu'],[],[],2109,7480,78471,[],[],https://twitter.com/narendramodi/status/1260046264554500096,False,,0,,,,,,,"[{'user_id': '18839785', 'username': 'narendramodi'}, {'user_id': '844890761409777664', 'username': 'CMOTamilNadu'}]",,,,
1259895292259794951,1259895292259794951,1589217420000,2020-05-11,22:47:00,IST,18839785,narendramodi,Narendra Modi,,"Had an extensive meeting with CMs. Each CM shared their perspective on battling COVID-19. 

We discussed the way ahead in the post-COVID era, the challenges in healthcare, education and other sectors. http://nm-4.com/cce9 ",[],['http://nm-4.com/cce9'],[],3937,8273,61671,[],[],https://twitter.com/narendramodi/status/1259895292259794951,False,,0,,,,,,,"[{'user_id': '18839785', 'username': 'narendramodi'}]",,,,
1259670710869348352,1259670710869348352,1589163875000,2020-05-11,07:54:35,IST,18839785,narendramodi,Narendra Modi,,"Today, technology is helping many in the efforts to make the world free from COVID-19. I salute all those at the forefront of research and innovation on ways to defeat Coronavirus. May we keep harnessing technology in order to create a healthier and better planet.",[],[],[],2852,8326,65528,[],[],https://twitter.com/narendramodi/status/1259670710869348352,False,,0,,,,,,,"[{'user_id': '18839785', 'username': 'narendramodi'}]",,,,
1259670302042189825,1259670302042189825,1589163778000,2020-05-11,07:52:58,IST,18839785,narendramodi,Narendra Modi,,"The tests in Pokhran in 1998 also showed the difference a strong political leadership can make. 

Here is what I had said about Pokhran, India’s scientists and Atal Ji’s remarkable leadership during one of the #MannKiBaat programmes. pic.twitter.com/UuJR1tLtrL",[],[],[],1591,9251,50882,['#mannkibaat'],[],https://twitter.com/narendramodi/status/1259670302042189825,False,,1,,,,,,,"[{'user_id': '18839785', 'username': 'narendramodi'}]",,,,
1259669775375949825,1259669775375949825,1589163652000,2020-05-11,07:50:52,IST,18839785,narendramodi,Narendra Modi,,"On National Technology Day, our nation salutes all those who are leveraging technology to bring a positive difference in the lives of others. We remember the exceptional achievement of our scientists on this day in 1998. It was a landmark moment in India’s history.",[],[],[],2301,11095,90711,[],[],https://twitter.com/narendramodi/status/1259669775375949825,False,,0,,,,,,,"[{'user_id': '18839785', 'username': 'narendramodi'}]",,,,
